<?xml version="1.0" encoding="UTF-8"?>
<?xml-stylesheet type="text/xsl" href="livres.xsl"?>
<!DOCTYPE cloud_hybrid SYSTEM "livres.dtd">
<cloud_hybrid>
    <overview>
        <overview_description>Le Cloud hybride combine les ressources de Cloud public et privé, offrant aux entreprises flexibilité, sécurité, et adaptabilité.</overview_description>
        <benefits>
            <benefit>Économie de coûts en utilisant le Cloud public pour des charges ponctuelles et le Cloud privé pour des données sensibles.</benefit>
            <benefit>Agilité permettant de répondre rapidement aux besoins changeants des entreprises.</benefit>
            <benefit>Optimisation des ressources en allouant dynamiquement les ressources en fonction de la demande.</benefit>
        </benefits>
    </overview>

    <technologies>
        <technology>
            <tech_name>Virtualisation</tech_name>
            <tech_description>La virtualisation est une technologie qui permet de créer des environnements informatiques virtuels, appelés machines virtuelles (VM), sur un matériel physique unique. Cette approche offre une flexibilité et une efficacité accrues dans l'utilisation des ressources informatiques, ce qui est essentiel dans le contexte du cloud hybride.
                La virtualisation repose sur la création d'une couche d'abstraction qui sépare les ressources matérielles des systèmes d'exploitation. L'hyperviseur gère cette abstraction en allouant les ressources du matériel (comme le CPU, la mémoire RAM et le stockage) aux différentes VM. Il existe deux types principaux d'hyperviseurs :
Hyperviseurs de type 1 : Fonctionnent directement sur le matériel, offrant une meilleure performance et une gestion efficace des ressources.
Hyperviseurs de type 2 : S'exécutent au-dessus d'un système d'exploitation hôte, ce qui peut introduire une légère surcharge mais facilite l'utilisation pour des environnements de développement ou de test.
Avantages de la virtualisation
Optimisation des ressources : La virtualisation permet une utilisation plus efficace du matériel physique en consolidant plusieurs serveurs virtuels sur un seul serveur physique, réduisant ainsi les coûts d'acquisition et de maintenance34.
Flexibilité et agilité : Les entreprises peuvent rapidement déployer des VM pour répondre à des besoins changeants, tester des applications dans un environnement isolé ou exécuter différents systèmes d'exploitation simultanément12.
Sécurité améliorée : Les VM offrent un niveau supplémentaire de sécurité en permettant l'analyse et la restauration à partir de snapshots, facilitant ainsi la gestion des menaces4.
Facilité de gestion : La gestion centralisée des machines virtuelles simplifie l'administration IT, permettant aux administrateurs de contrôler plusieurs environnements à partir d'une seule interface3.
            </tech_description>
            <image><![CDATA[https://encrypted-tbn0.gstatic.com/images?q=tbn:ANd9GcR6wE7hGqaW7dQ4XrmPt7HJcEhHyNrx5tP0FA&s]]></image>
        </technology>
        <technology>
            <tech_name>API et Intégration</tech_name>
            <tech_description>Les API (Interfaces de Programmation d'Applications) jouent un rôle crucial dans l'intégration et l'interopérabilité des systèmes, en particulier dans un environnement de cloud hybride. Ce type d'architecture combine des ressources de cloud public et privé, permettant aux entreprises de bénéficier d'une flexibilité accrue tout en maintenant la sécurité et le contrôle sur leurs données sensibles.
                Interopérabilité entre systèmes : Les API facilitent la communication entre différents systèmes, qu'ils soient basés sur le cloud public ou privé. Elles permettent aux applications d'échanger des données et des fonctionnalités, rendant possible la migration d'applications et de données entre ces environnements. Par exemple, une entreprise peut utiliser une API pour transférer des données d'une application hébergée sur un cloud privé vers une solution SaaS sur un cloud public1.
Migration fluide des données : Lorsqu'une organisation souhaite migrer ses données vers le cloud, les API simplifient ce processus en permettant une synchronisation efficace des données. Elles gèrent les différences de format et de technologie entre les bases de données source et destination, garantissant que les données sont correctement transférées et intégrées1. Cela est particulièrement important dans un environnement hybride où les systèmes peuvent varier considérablement.
Gestion des données disparates : Dans un cloud hybride, les données peuvent provenir de sources multiples et variées. Les API aident à consolider ces données en permettant leur accès et leur manipulation à partir d'un point central. Cela réduit la complexité liée à l'intégration des données provenant de différents systèmes1.
Support pour différents formats de données : Les API sont conçues pour gérer divers formats de données, ce qui est essentiel lors de la migration entre systèmes qui peuvent avoir des structures différentes. Elles assurent que les données migrées conservent leur intégrité et leur accessibilité, même si elles proviennent de technologies disparates1.
Automatisation et notifications en temps réel : Les API permettent également l'automatisation des processus de migration et d'intégration. Par exemple, elles peuvent envoyer des notifications lorsque certaines conditions sont remplies ou lorsque des erreurs se produisent, facilitant ainsi une gestion proactive des migrations1.
            </tech_description>
            <image><![CDATA[https://chisellabs.com/glossary/wp-content/uploads/2021/06/What-is-an-API.png]]></image>
        </technology>
        <technology>
            <tech_name>Orchestration et Automatisation</tech_name>
            <tech_description>Les plateformes d'orchestration et d'automatisation sont devenues des éléments essentiels pour la gestion efficace des environnements hybrides, permettant aux entreprises de combiner des ressources de cloud public et privé tout en optimisant les coûts et la performance.
                Importance de l'Orchestration
L'orchestration se réfère à la gestion coordonnée de plusieurs services et systèmes pour exécuter des workflows complexes. Dans un environnement hybride, cela implique la synchronisation des ressources sur site et dans le cloud. Les outils d'orchestration permettent de :
Automatiser les processus : En orchestrant les tâches entre différents systèmes, les entreprises peuvent automatiser des processus tels que le déploiement d'applications, la gestion des configurations, et la mise à l'échelle des ressources.
Améliorer la visibilité : Une plateforme d'orchestration offre une vue centralisée de l'ensemble de l'infrastructure, facilitant ainsi le suivi et l'optimisation des opérations à travers différents environnements cloud12.
Réduire les erreurs humaines : L'automatisation des workflows minimise les interventions manuelles, ce qui réduit le risque d'erreurs et améliore la cohérence des opérations
            </tech_description>
            <image><![CDATA[https://s7280.pcdn.co/wp-content/uploads/2017/03/PDWO00001114225-Six-Ways-Workload-Automation-Drives-Digital-Business.png]]></image>
        </technology>
    </technologies>

    <use_cases>
        <use_case>
            <usecase_title>Reprise après sinistre</usecase_title>
            <usecase_description>Les entreprises adoptent de plus en plus le cloud hybride pour mettre en place des stratégies de reprise après sinistre efficaces. Cette approche leur permet de stocker des sauvegardes de données dans le cloud public tout en maintenant des systèmes critiques sur site ou dans un cloud privé. Voici quelques éléments clés concernant la reprise après sinistre dans un environnement hybride :
                Sauvegarde et récupération des données : Le cloud hybride permet aux entreprises de sauvegarder leurs données sensibles sur des serveurs privés tout en utilisant le cloud public pour des sauvegardes supplémentaires. En cas de sinistre, les données peuvent être rapidement restaurées à partir du cloud public, minimisant ainsi les temps d'arrêt.
                Planification de la continuité des activités : Les entreprises peuvent élaborer des plans de continuité qui exploitent les ressources du cloud public pour maintenir les opérations même lorsque les systèmes internes sont affectés. Cela garantit une résilience accrue face aux perturbations.
                Tests réguliers : Les environnements hybrides facilitent la mise en place de tests réguliers des processus de reprise après sinistre, permettant aux entreprises de s'assurer que leurs systèmes peuvent être restaurés rapidement et efficacement.</usecase_description>
        </use_case>
        <use_case>
            <usecase_title>Scalabilité pour les applications saisonnières</usecase_title>
            <usecase_description>Le cloud hybride offre une flexibilité inégalée pour gérer les applications ayant des charges de travail fluctuantes, comme celles utilisées par les services clients pendant les périodes de forte demande. Voici comment cela fonctionne :
                Adaptation dynamique : Pendant les périodes de pointe, comme les soldes ou les fêtes, les entreprises peuvent rapidement augmenter leurs capacités en utilisant le cloud public pour traiter la charge supplémentaire, sans avoir à investir dans des infrastructures permanentes.
                Modèle de paiement à l'usage : Grâce à ce modèle, les entreprises ne paient que pour les ressources qu'elles consomment réellement pendant ces périodes de forte demande, ce qui permet une gestion budgétaire plus efficace.